{
  "$schema": "http://json-schema.org/draft-07/schema#",
  "title": "RasQberry Demo Manifest",
  "description": "Schema for RasQberry Two demo manifest files (rq_demo_*.json)",
  "type": "object",
  "required": ["id", "name", "category", "description", "entrypoint"],
  "properties": {
    "id": {
      "type": "string",
      "pattern": "^[a-z0-9-]+$",
      "description": "Unique identifier (lowercase, hyphens only), matches filename rq_demo_<id>.json"
    },
    "name": {
      "type": "string",
      "description": "Human-readable display name for menus and desktop entries"
    },
    "category": {
      "type": "string",
      "enum": ["game", "visualization", "education", "jupyter", "led-demo", "tool"],
      "description": "Kind of demo (the website used it for its headings before groups)"
    },
    "group": {
      "type": "string",
      "enum": ["led-panel", "play", "projects", "learn", "workshops", "contributed"],
      "description": "Desktop folder, RasQberry menu submenu and website heading (demo-groups.json). Shipped demos only; without it, a guess from needs_hw.leds and category. A catalogue demo goes to its known-demos.json entry's group, else to Contributed demos"
    },
    "description": {
      "type": "string",
      "maxLength": 200,
      "description": "Short description for menu and desktop entry"
    },
    "maturity": {
      "type": "string",
      "enum": ["stable", "beta"],
      "default": "stable",
      "description": "beta: a new or less-tested demo. Shown as '(beta)' in the RasQberry menu, the catalogue and the desktop tooltip; its start invites feedback (demo-feedback issue form). Variants may set it too."
    },
    "keywords": {
      "type": "array",
      "items": {"type": "string"},
      "description": "Search keywords for discovery"
    },
    "entrypoint": {
      "type": "object",
      "description": "How to launch the demo. Either 'type' or 'launcher' must be specified. If both are present, 'launcher' serves as fallback when the type handler cannot run directly.",
      "properties": {
        "type": {
          "type": "string",
          "enum": ["python", "jupyter", "docker", "browser", "web-static"],
          "description": "Launcher type: jupyter (notebook server), docker (container), browser (URL or local server), python (script), web-static (serve a static dir over http.server as the user). If omitted, 'launcher' is used directly."
        },
        "command": {
          "type": "string",
          "description": "Command to execute (e.g., python3, bash)"
        },
        "script": {
          "type": "string",
          "description": "Script file to run"
        },
        "args": {
          "type": "array",
          "items": {"type": "string"},
          "description": "Command-line arguments"
        },
        "working_dir": {
          "type": "string",
          "description": "Working directory relative to demos root (. = demo root)"
        },
        "launcher": {
          "type": "string",
          "description": "Existing launcher script in RQB2-bin. Used as primary launcher if no 'type' specified, or as fallback for complex demos that can't be handled by type-specific handlers."
        },
        "jupyter_port": {
          "type": "integer",
          "description": "Jupyter notebook server port"
        },
        "notebook": {
          "type": "string",
          "description": "Notebook file to open (relative to working_dir) for jupyter-type demos"
        },
        "docker_image": {
          "type": "string",
          "description": "Docker image, pinned per RasQberry release: name@sha256:<digest>, or name:<40-char source commit> for an image built by CI from a pinned source commit (the local fallback build tags the same name). 'Update demos' can move it (rq_demo_image)."
        },
        "docker_image_tag": {
          "type": "string",
          "description": "The publisher's tag for the docker_image digest (e.g. QuBins' monthly snapshot '2.5-xl-20261008', kept for 12 months), for people reading the manifest. Not used to download: the digest is the pin."
        },
        "docker_image_fallback": {
          "type": "string",
          "description": "A tag of the same image (name:tag, never a digest), downloaded instead when the registry no longer offers the docker_image digest (its publisher pruned it); recorded as the version in use for that release pin (rq_demo_docker_pull). Required with a digest pin in shipped manifests."
        },
        "docker_port": {
          "type": "integer",
          "description": "Port exposed by Docker container"
        },
        "browser_url": {
          "type": "string",
          "description": "URL to open in browser (for browser-based demos)"
        },
        "serve_dir": {
          "type": "string",
          "description": "Directory (relative to the demo checkout) to serve for web-static demos, e.g. 'build'. Defaults to the demo root if omitted."
        },
        "port": {
          "type": "integer",
          "minimum": 1024,
          "maximum": 65535,
          "description": "TCP port for the web-static http.server (1024-65535)"
        },
        "keyboard": {
          "type": "boolean",
          "default": false,
          "description": "python type: the program reads the keyboard itself (questions in its window). It then runs in front and stops with Ctrl+C or by closing the window. Otherwise its window reads Enter, which stops it like every other demo."
        },
        "stop_on_exit": {
          "type": "array",
          "items": { "type": "string" },
          "description": "Command-line patterns (pgrep -f) of helper processes the demo starts that outlive it, e.g. an emulator window. Stopped when the demo exits, unless they were already running before it started."
        }
      }
    },
    "install": {
      "type": "object",
      "description": "Installation configuration",
      "properties": {
        "preinstalled": {
          "type": "boolean",
          "default": false,
          "description": "true if bundled in image, false if cloned on first run"
        },
        "repo_url": {
          "type": "string",
          "format": "uri",
          "description": "Git URL for dynamic installation"
        },
        "ref": {
          "type": "string",
          "pattern": "^[0-9a-fA-F]{40}$",
          "description": "Full 40-character upstream commit SHA to pin the checkout to. Strongly recommended for any repo RasQberry does not own, and effectively required when install.patch_file is set: a patch is written against specific lines of a specific upstream version, so tracking a moving HEAD lets an unrelated upstream commit break the install. Omit to track the default branch (unpinned). Bump deliberately: re-verify the patch, then update the SHA."
        },
        "marker_file": {
          "type": "string",
          "description": "File that must exist to confirm installation"
        },
        "patch_file": {
          "type": "string",
          "description": "Patch file name in RQB2-config/patches/"
        },
        "pip_requirements": {
          "type": "boolean",
          "default": false,
          "description": "Install requirements.txt after cloning"
        },
        "portal_ref": {
          "type": "string",
          "pattern": "^([0-9a-fA-F]{40})?$",
          "description": "fun-with-quantum: the Fun-with-Quantum commit whose website bundle (fwq-portal-<commit>.tar.gz on the portal-bundles release) is installed for offline use, separate from install.ref (the notebooks). Empty: no local copy, the website entry opens fun-with-quantum.org."
        },
        "portal_sha256": {
          "type": "string",
          "pattern": "^([0-9a-fA-F]{64})?$",
          "description": "SHA-256 of that bundle. Empty: the published .sha256 is used."
        },
        "post_install": {
          "type": "string",
          "description": "Optional RasQberry script run after checkout/patch as '<script> --path <demo_dir>' with the venv python. Use when a demo needs setup before it is usable - and note the marker_file may be GENERATED by this step rather than shipped upstream (e.g. quantum-paradoxes' WELCOME.ipynb)."
        },
        "pre_remove": {
          "type": "string",
          "description": "Optional RasQberry script run as '<script> --remove --path <demo_dir>' (as the user, with bash) before 'Remove a demo' deletes the checkout. Use when the install set up more than the checkout, e.g. a system service (Entangible)."
        },
        "download_all": {
          "type": "boolean",
          "default": true,
          "description": "false: 'Download all demos' leaves this demo out (it needs extra hardware or sets up a system service); it is downloaded, after asking, at its first start."
        },
        "installed_flag": {
          "type": "string",
          "description": "Optional environment variable (e.g. QUANTUM_PARADOXES_INSTALLED) set to true once installed. The raspi-config menu reads these flags, so declare it for any demo the menu tracks."
        },
        "download": {
          "type": "object",
          "description": "What a first install fetches, for the one consent dialog every first install shows (size, time, free space; refused when the space is too low). Measured values; keep them current when a pin or image changes.",
          "properties": {
            "what": {"type": "string", "description": "What is fetched, e.g. 'Jupyter notebooks from GitHub'"},
            "download_mb": {"type": "integer", "minimum": 0, "description": "Download size in MB (1 MB = 1,000,000 bytes)"},
            "disk_mb": {"type": "integer", "minimum": 0, "description": "Space on the SD card afterwards in MB (default: download_mb)"},
            "peak_mb": {"type": "integer", "minimum": 0, "description": "Extra space needed only while installing, e.g. a Docker build cache"},
            "time": {"type": "string", "description": "Rough duration on a Pi, measured (user test 2026-10-04: a home line), e.g. '10-30 seconds', '1 minute', '3-5 minutes'. Download all adds them up"},
            "url": {"type": "string", "description": "Checked for reachability before asking (default: repo_url, the Docker registry, else GitHub)"},
            "shares": {"type": "string", "description": "Demos with the same value share one download (counted once by 'Download all demos')"},
            "cached": {
              "type": "object",
              "description": "When most of the download is in a cache on the DATA partition (it survives A/B updates and Remove), the dialog shows these values instead",
              "required": ["path"],
              "properties": {
                "path": {"type": "string", "description": "A file below /data that is there only with a warm cache, e.g. the pinned web bundle; keep it current with the pin"},
                "download_mb": {"type": "integer", "minimum": 0, "description": "What is still downloaded, in MB"},
                "time": {"type": "string", "description": "Rough duration with the cache, measured"}
              }
            }
          }
        },
        "source": {
          "type": "object",
          "description": "Git sources that install.installer (or the demo's launcher) fetches, pinned like repo_url/ref. 'Update demos' moves the ref on request (rq_demo_ref).",
          "properties": {
            "repo_url": {"type": "string", "format": "uri"},
            "ref": {"type": "string", "pattern": "^[0-9a-fA-F]{40}$"}
          },
          "required": ["repo_url", "ref"]
        },
        "update": {
          "type": "object",
          "description": "How 'Update demos' finds newer versions of the Docker image on ghcr.io",
          "properties": {
            "docker_tags": {"type": "string", "description": "Regular expression for the version tags, e.g. ^[0-9a-f]{7}-jupyter$"},
            "docker_latest": {"type": "string", "description": "Tag of the newest build, e.g. jupyter"},
            "docker_order": {"type": "string", "enum": ["date", "version"], "description": "What a newer version is: a later build (date, the default), or a higher Qiskit version (version: the org.qubins.qiskit.patch label, else the tag's major.minor; Quantum Lab). Snapshot tags (*-YYYYMMDD) are preferred over moving tags either way."}
          }
        },
        "installer": {
          "type": "string",
          "description": "Optional raspi-config install function (e.g. do_ibm_tutorials_install) that owns this demo's installation instead of the generic clone. Use ONLY when the setup cannot be expressed as 'clone a repo at a ref' - e.g. the IBM learning pair, which is one shared sparse checkout of Qiskit/documentation feeding two demos, with generated markers and a licence dialog. Mutually exclusive with repo_url: declaring both is ambiguous about which fetches the sources."
        }
      }
    },
    "needs_hw": {
      "type": "object",
      "description": "Hardware requirements",
      "properties": {
        "leds": {
          "type": "boolean",
          "default": false,
          "description": "Requires LED matrix"
        },
        "buttons": {
          "type": "boolean",
          "default": false,
          "description": "Requires physical buttons"
        },
        "network": {
          "type": "boolean",
          "default": false,
          "description": "Requires internet connectivity at runtime"
        },
        "display": {
          "type": "string",
          "enum": ["none", "optional", "required"],
          "default": "none",
          "description": "Display requirement: none=headless OK, optional=prefers GUI, required=GUI mandatory"
        }
      }
    },
    "needs_ibm_token": {
      "type": "string",
      "enum": ["none", "prefer", "required"],
      "default": "none",
      "description": "IBM Quantum token requirement"
    },
    "browser_based": {
      "type": "boolean",
      "default": false,
      "description": "Runs in Chromium browser"
    },
    "loop_ok": {
      "type": "boolean",
      "default": true,
      "description": "Safe to include in demo loop (non-interactive, auto-exits)"
    },
    "timeout": {
      "type": "integer",
      "default": 60,
      "description": "Default timeout in seconds for demo loop (0 = no timeout)"
    },
    "icon": {
      "type": "object",
      "description": "Icon for desktop entry",
      "properties": {
        "type": {
          "type": "string",
          "enum": ["system", "custom", "none"],
          "description": "system=freedesktop icon name, custom=path to file, none=no icon"
        },
        "path": {
          "type": "string",
          "description": "Icon name or file path"
        }
      }
    },
    "menu": {
      "type": "object",
      "description": "Menu configuration",
      "properties": {
        "show": {
          "type": "boolean",
          "default": true,
          "description": "Show in raspi-config menu"
        },
        "parent": {
          "type": "string",
          "description": "Parent menu ID for submenus"
        },
        "order": {
          "type": "integer",
          "default": 50,
          "description": "Sort order (lower = earlier in menu)"
        },
        "variant_menu": {
          "type": "boolean",
          "default": false,
          "description": "Open a submenu of the variants in the RasQberry menu instead of starting the default entry"
        }
      }
    },
    "desktop": {
      "type": "object",
      "description": "Desktop launcher configuration",
      "properties": {
        "show": {
          "type": "boolean",
          "default": true,
          "description": "Create .desktop file"
        },
        "terminal": {
          "type": "boolean",
          "default": true,
          "description": "Run in terminal window"
        }
      }
    },
    "variants": {
      "type": "array",
      "description": "Demo modes/variants (e.g., GUI vs console)",
      "items": {
        "type": "object",
        "required": ["id", "name"],
        "properties": {
          "id": {
            "type": "string",
            "description": "Variant identifier"
          },
          "name": {
            "type": "string",
            "description": "Variant display name"
          },
          "maturity": {
            "type": "string",
            "enum": ["stable", "beta"],
            "description": "As the top-level maturity, for this variant only"
          },
          "args": {
            "type": "array",
            "items": {"type": "string"},
            "description": "Additional arguments for this variant"
          },
          "needs_hw": {
            "type": "object",
            "description": "Override hardware requirements for this variant"
          },
          "entrypoint": {
            "type": "object",
            "description": "Override entrypoint for this variant"
          }
        }
      }
    }
  }
}
