{
  "id": "composer",
  "name": "IBM Quantum Composer",
  "category": "education",
  "group": "learn",
  "description": "Design and simulate quantum circuits in your web browser",
  "keywords": [
    "quantum",
    "qiskit",
    "composer",
    "circuit",
    "IBM",
    "web"
  ],
  "entrypoint": {
    "type": "browser",
    "browser_url": "https://quantum.cloud.ibm.com/composer"
  },
  "install": {
    "preinstalled": true
  },
  "needs_hw": {
    "leds": false,
    "network": true,
    "display": "required"
  },
  "needs_ibm_token": "prefer",
  "browser_based": true,
  "loop_ok": false,
  "timeout": 0,
  "icon": {
    "type": "custom",
    "path": "/usr/share/icons/rasqberry/ibm-quantum.png"
  },
  "menu": {
    "show": true,
    "order": 60
  },
  "desktop": {
    "show": true,
    "terminal": false
  }
}
