{
  "id": "quantum-raspberry-tie",
  "name": "Quantum Raspberry Tie",
  "category": "visualization",
  "group": "led-panel",
  "description": "Measured qubits on the LED panel, from a simulator or a real IBM quantum computer",
  "keywords": [
    "quantum",
    "visualization",
    "circuit",
    "sense-hat",
    "led"
  ],
  "entrypoint": {
    "type": "python",
    "script": "QuantumRaspberryTie.v8_0.py",
    "working_dir": "quantum-raspberry-tie",
    "stop_on_exit": [
      "/usr/bin/sense_emu_gui"
    ]
  },
  "install": {
    "preinstalled": false,
    "repo_url": "https://github.com/KPRoche/quantum-raspberry-tie.git",
    "ref": "08bc07b02d3e3a17d8bf0fdaefc0102984f8c8f6",
    "marker_file": "QuantumRaspberryTie.v8_0.py",
    "patch_file": "quantum-raspberry-tie.patch",
    "download": {
      "what": "Raspberry Tie program from GitHub",
      "download_mb": 24,
      "time": "10-30 seconds"
    },
    "installed_flag": "QUANTUM_RASPBERRY_TIE_INSTALLED"
  },
  "needs_hw": {
    "leds": true,
    "display": "required"
  },
  "needs_ibm_token": "prefer",
  "browser_based": false,
  "loop_ok": true,
  "timeout": 60,
  "icon": {
    "type": "custom",
    "path": "/usr/share/icons/rasqberry/quantum-raspberry-tie.svg"
  },
  "menu": {
    "show": true,
    "order": 40
  },
  "desktop": {
    "show": true,
    "terminal": true
  },
  "variants": [
    {
      "id": "simulator",
      "name": "Local simulator (no account needed)",
      "args": [
        "-local"
      ]
    },
    {
      "id": "noise",
      "name": "Local simulator with a noise model",
      "args": [
        "-nois"
      ]
    },
    {
      "id": "real",
      "name": "Real IBM Quantum computer (IBM Quantum account)",
      "args": [
        "-b:least"
      ],
      "entrypoint": {
        "keyboard": true
      },
      "needs_hw": {
        "network": true
      }
    }
  ]
}
