{
  "id": "quantum-mixer",
  "name": "Quantum Mixer",
  "category": "visualization",
  "group": "projects",
  "description": "Mix a cocktail, an ice cream or a coffee with a quantum circuit (Docker container)",
  "keywords": [
    "quantum",
    "mixer",
    "circuit",
    "builder",
    "docker",
    "web"
  ],
  "entrypoint": {
    "type": "docker",
    "docker_image": "ghcr.io/janlahmann/quantum-mixer@sha256:e217ac0ebd40019d6b2296ff281443e1210920d158f94edd2e0f189946cbc835",
    "docker_image_fallback": "ghcr.io/janlahmann/quantum-mixer:8a9cf328910c107cd167d16eaf12307b5505cea5",
    "docker_port": 8080,
    "launcher": "quantum-mixer.sh"
  },
  "install": {
    "preinstalled": false,
    "installer": "do_quantum_mixer_install",
    "installed_flag": "QUANTUM_MIXER_INSTALLED",
    "source": {
      "repo_url": "https://github.com/JanLahmann/quantum-mixer.git",
      "ref": "8a9cf328910c107cd167d16eaf12307b5505cea5"
    },
    "update": {
      "docker_tags": "^[0-9a-f]{40}$",
      "docker_latest": "latest"
    },
    "download": {
      "what": "Docker image built by the quantum-mixer repository's CI",
      "download_mb": 900,
      "disk_mb": 2300,
      "time": "2-15 minutes"
    }
  },
  "needs_hw": {
    "leds": false,
    "network": false,
    "display": "required"
  },
  "needs_ibm_token": "none",
  "browser_based": true,
  "loop_ok": false,
  "timeout": 0,
  "icon": {
    "type": "custom",
    "path": "/usr/share/icons/rasqberry/quantum-mixer.svg"
  },
  "menu": {
    "show": true,
    "order": 20
  },
  "desktop": {
    "show": true,
    "terminal": true
  }
}
