{
  "id": "ibm-tutorials",
  "name": "IBM Quantum Tutorials",
  "category": "jupyter",
  "group": "learn",
  "description": "Official IBM Quantum tutorials from Qiskit documentation (CC BY-SA 4.0)",
  "keywords": [
    "quantum",
    "jupyter",
    "notebook",
    "ibm",
    "qiskit",
    "tutorial",
    "education"
  ],
  "entrypoint": {
    "type": "jupyter",
    "working_dir": "ibm-quantum-learning",
    "jupyter_port": 8889,
    "launcher": "rq_ibm_tutorials.sh"
  },
  "install": {
    "preinstalled": false,
    "marker_file": "WELCOME-tutorials.ipynb",
    "installer": "do_ibm_tutorials_install",
    "source": {
      "repo_url": "https://github.com/Qiskit/documentation.git",
      "ref": "b1126b46e4faa9113a6dd68356feb09f1b53a48c"
    },
    "installed_flag": "IBM_TUTORIALS_INSTALLED",
    "download": {
      "what": "IBM Quantum tutorials and courses from GitHub (Qiskit/documentation, CC BY-SA 4.0)",
      "download_mb": 80,
      "disk_mb": 150,
      "time": "1 minute",
      "shares": "ibm-quantum-learning"
    }
  },
  "needs_hw": {
    "leds": false,
    "display": "optional"
  },
  "needs_ibm_token": "prefer",
  "browser_based": true,
  "loop_ok": false,
  "timeout": 0,
  "icon": {
    "type": "custom",
    "path": "/usr/share/icons/rasqberry/ibm-tutorials.svg"
  },
  "menu": {
    "show": true,
    "order": 40
  },
  "desktop": {
    "show": true,
    "terminal": true
  }
}
