{
  "id": "quantum-lights-out",
  "name": "Quantum Lights Out",
  "category": "visualization",
  "group": "led-panel",
  "description": "Watch Grover's search solve Lights Out puzzles on the LED panel, one after another",
  "keywords": [
    "quantum",
    "grover",
    "puzzle",
    "lights",
    "qiskit",
    "circuit"
  ],
  "entrypoint": {
    "type": "python",
    "script": "lights_out.py",
    "working_dir": "Quantum-Lights-Out"
  },
  "install": {
    "preinstalled": false,
    "repo_url": "https://github.com/Luka-D/Quantum-Lights-Out.git",
    "ref": "dcd7550fe3eaf37d9419e15349b76b49a9af84f3",
    "marker_file": "lights_out.py",
    "patch_file": "quantum-lights-out.patch",
    "download": {
      "what": "Lights Out solver from GitHub",
      "download_mb": 1,
      "time": "10-30 seconds"
    },
    "installed_flag": "QUANTUM_LIGHTS_OUT_INSTALLED"
  },
  "needs_hw": {
    "leds": true,
    "display": "optional"
  },
  "needs_ibm_token": "none",
  "browser_based": false,
  "loop_ok": true,
  "timeout": 60,
  "icon": {
    "type": "system",
    "path": "applications-games"
  },
  "menu": {
    "show": true,
    "order": 30
  },
  "desktop": {
    "show": true,
    "terminal": true
  },
  "variants": [
    {
      "id": "gui",
      "name": "LED panel",
      "needs_hw": {
        "display": "required"
      }
    },
    {
      "id": "console",
      "name": "Console",
      "args": [
        "--console"
      ],
      "needs_hw": {
        "display": "none"
      }
    }
  ]
}
