{
  "id": "led-painter",
  "name": "LED-Painter",
  "category": "tool",
  "description": "Paint and draw on the LED panel from a graphical interface",
  "keywords": [
    "led",
    "paint",
    "draw",
    "art",
    "matrix",
    "gui"
  ],
  "entrypoint": {
    "type": "python",
    "script": "LED_painter.py",
    "working_dir": "RasQberry-Two-LED-Painter",
    "launcher": "rq_led_painter.sh"
  },
  "install": {
    "preinstalled": false,
    "repo_url": "https://github.com/Luka-D/RasQberry-Two-LED-Painter.git",
    "ref": "6a6a924bb475002480a425dd7fc934599abf94eb",
    "marker_file": "LED_painter.py",
    "post_install": "rq_led_painter.sh",
    "installed_flag": "LED_PAINTER_INSTALLED",
    "download": {
      "what": "LED-Painter app from GitHub",
      "download_mb": 2,
      "time": "1 minute"
    }
  },
  "needs_hw": {
    "leds": true,
    "display": "required"
  },
  "needs_ibm_token": "none",
  "browser_based": false,
  "loop_ok": false,
  "timeout": 0,
  "icon": {
    "type": "system",
    "path": "applications-graphics"
  },
  "menu": {
    "show": true,
    "order": 70
  },
  "desktop": {
    "show": true,
    "terminal": true
  }
}
