{
  "id": "quantum-paradoxes",
  "name": "Quantum Paradoxes",
  "category": "jupyter",
  "group": "play",
  "description": "Interactive Jupyter notebooks exploring quantum paradoxes and phenomena",
  "keywords": [
    "quantum",
    "jupyter",
    "notebook",
    "paradox",
    "education",
    "physics"
  ],
  "entrypoint": {
    "type": "jupyter",
    "working_dir": "quantum-paradoxes",
    "jupyter_port": 8891,
    "launcher": "rq_quantum_paradoxes.sh"
  },
  "install": {
    "preinstalled": false,
    "repo_url": "https://github.com/maria-violaris/quantum-paradoxes",
    "ref": "78bb6b5b49cabb047c2c586318d307f589e1204d",
    "marker_file": "WELCOME.ipynb",
    "post_install": "setup_quantum_paradoxes.py",
    "installed_flag": "QUANTUM_PARADOXES_INSTALLED",
    "download": {
      "what": "Jupyter notebooks from GitHub",
      "download_mb": 31,
      "time": "10-30 seconds"
    }
  },
  "needs_hw": {
    "leds": false,
    "display": "optional"
  },
  "needs_ibm_token": "prefer",
  "browser_based": true,
  "loop_ok": false,
  "timeout": 0,
  "icon": {
    "type": "custom",
    "path": "/usr/share/icons/rasqberry/orbit-pi.png"
  },
  "menu": {
    "show": true,
    "order": 20
  },
  "desktop": {
    "show": true,
    "terminal": true
  }
}
