{
  "id": "quantum-lab",
  "name": "Qiskit Live (QuBins)",
  "category": "education",
  "group": "learn",
  "description": "Local JupyterLab quantum environment (QuBins signed community image) preloaded with the IBM Quantum Learning course notebooks (Docker container)",
  "keywords": [
    "quantum",
    "jupyter",
    "jupyterlab",
    "qiskit",
    "docker",
    "qubins",
    "ibm",
    "course",
    "education"
  ],
  "entrypoint": {
    "type": "docker",
    "docker_image": "ghcr.io/qubins/images@sha256:dd8f4f727fe450c9a13c8eb1404e5c471274f28f91be8bdf1fac14436ff33a48",
    "docker_image_tag": "2.5-xl-20261008",
    "docker_image_fallback": "ghcr.io/qubins/images:2.5-xl",
    "docker_port": 8892,
    "launcher": "rq_quantum_lab.sh"
  },
  "install": {
    "preinstalled": false,
    "download": {
      "what": "Docker image from ghcr.io (QuBins), and the IBM course notebooks if missing",
      "download_mb": 890,
      "disk_mb": 4000,
      "time": "2-15 minutes"
    },
    "update": {
      "docker_tags": "^[0-9]+\\.[0-9]+-xl(-[0-9]{8})?$",
      "docker_latest": "latest-xl",
      "docker_order": "version"
    }
  },
  "needs_hw": {
    "leds": false,
    "network": true,
    "display": "optional"
  },
  "needs_ibm_token": "none",
  "browser_based": true,
  "loop_ok": false,
  "timeout": 0,
  "icon": {
    "type": "custom",
    "path": "/usr/share/icons/rasqberry/quantum-lab.svg"
  },
  "menu": {
    "show": true,
    "order": 30
  },
  "desktop": {
    "show": true,
    "terminal": true
  }
}
